{
 "schema_version": 1,
 "name": "etl_uu_to_sung_a_hedz_s1",
 "corner_order": [
  "M0_Q0",
  "M100_Q0",
  "M0_Q100",
  "M100_Q100"
 ],
 "secondary_axis": {
  "authored": true,
  "note": "Q100 initialised as an exact authored copy of Q0 (linked_exact_to_Q0 per lane); a broken link carries per-lane operator provenance"
 },
 "structure": {
  "model": "isolated_p2k_conditioners_measured_lanes_v1",
  "status": "applied",
  "authority": "recipes/architectures/P2k_013_TalkingHedz.json",
  "authority_sha256": "6108cba9a3b4145df798a2c8903a614e1d4a744a7cdaae3cf5482ceef828fb57",
  "numeric_authority": "ref/presets/P2k_013_talking_hedz.bin",
  "numeric_authority_sha256": "e686bf124086bf79e598850d803b606a6c0b89a0622ef0bf428dc617a2fb777a",
  "rate_authority": "evidence/emulatorx_binary_filter_rip_20260729/P2K_RATE_BANK_MANIFEST.json",
  "rate_authority_sha256": "156eebc2de1451cd868446047bf1f188d04443b9017f947624ce581f9cc26fb8",
  "recipe_index": "recipes/tables/recipe_index_v1.json",
  "recipe_index_sha256": "1c8164837b4348b0f5815cbd9f5efcaef03a0f6d839744c477de96fdf03f8b50",
  "conditioning_slots": [
   1
  ],
  "measured_slots": [
   2,
   3,
   4,
   5
  ],
  "source_datum_rate_hz": 44100.0,
  "authoring_datum_rate_hz": 44100.0
 },
 "source_catalog": "filters/source_catalog.json",
 "stage_plan": [
  {
   "slot": 0,
   "lane_id": "lane0",
   "role": "TalkingHedz S1 conditioning donor",
   "law": "free",
   "topology": "conjugate",
   "pole_zero_relation": "isolated P2K conditioning section; numeric scope limited to this lane",
   "law_params": {},
   "limits": {
    "max_pole_octave_step": null,
    "max_radius_step": null,
    "max_scale_step_db": null
   }
  },
  {
   "slot": 1,
   "lane_id": "lane1",
   "role": "pair F1(M0) -> F1(M100)",
   "law": "free",
   "topology": "conjugate",
   "pole_zero_relation": "measured pole; zero unauthored",
   "law_params": {},
   "limits": {
    "max_pole_octave_step": 3.0,
    "max_radius_step": 0.5,
    "max_scale_step_db": 24.0
   }
  },
  {
   "slot": 2,
   "lane_id": "lane2",
   "role": "pair F2(M0) -> F2(M100)",
   "law": "free",
   "topology": "conjugate",
   "pole_zero_relation": "measured pole; zero unauthored",
   "law_params": {},
   "limits": {
    "max_pole_octave_step": 3.0,
    "max_radius_step": 0.5,
    "max_scale_step_db": 24.0
   }
  },
  {
   "slot": 3,
   "lane_id": "lane3",
   "role": "pair F3(M0) -> F3(M100)",
   "law": "free",
   "topology": "conjugate",
   "pole_zero_relation": "measured pole; zero unauthored",
   "law_params": {},
   "limits": {
    "max_pole_octave_step": 3.0,
    "max_radius_step": 0.5,
    "max_scale_step_db": 24.0
   }
  },
  {
   "slot": 4,
   "lane_id": "lane4",
   "role": "pair F4(M0) -> F4(M100)",
   "law": "free",
   "topology": "conjugate",
   "pole_zero_relation": "measured pole; zero unauthored",
   "law_params": {},
   "limits": {
    "max_pole_octave_step": 3.0,
    "max_radius_step": 0.5,
    "max_scale_step_db": 24.0
   }
  },
  {
   "slot": 5,
   "lane_id": "lane5",
   "role": "UNASSIGNED \u2014 name this lane's musical role",
   "law": "free",
   "topology": "conjugate",
   "pole_zero_relation": "UNASSIGNED",
   "law_params": {},
   "limits": {
    "max_pole_octave_step": 3.0,
    "max_radius_step": 0.5,
    "max_scale_step_db": 24.0
   }
  }
 ],
 "lanes": {
  "lane0": {
   "assignments": {
    "M0_Q0": {
     "state": "active",
     "candidate": {
      "catalog_record": null,
      "selector": {
       "architecture": "P2k_013_TalkingHedz.json",
       "slot": 1,
       "corner": "M0_Q0",
       "words_u16": [
        27900,
        53244,
        60668,
        47356,
        53754
       ]
      }
     },
     "pole": {
      "hz": 10522.874842200028,
      "r": 0.9752921424801871
     },
     "zero": {
      "hz": 391.4573392730128,
      "r": 0.9354388148709607
     },
     "scale": 0.5618896484375,
     "provenance": {
      "source": "ref/presets/P2k_013_talking_hedz.bin",
      "architecture": "recipes/architectures/P2k_013_TalkingHedz.json",
      "rate_authority": "evidence/emulatorx_binary_filter_rip_20260729/P2K_RATE_BANK_MANIFEST.json",
      "method": "isolated_p2k_conditioning_biquad",
      "source_datum_rate_hz": 44100.0,
      "authoring_datum_rate_hz": 44100.0,
      "rate_treatment": "exact 44100 bank; no rate or radius conversion"
     }
    },
    "M100_Q0": {
     "state": "active",
     "candidate": {
      "catalog_record": null,
      "selector": {
       "architecture": "P2k_013_TalkingHedz.json",
       "slot": 1,
       "corner": "M100_Q0",
       "words_u16": [
        41724,
        52220,
        59388,
        49916,
        53424
       ]
      }
     },
     "pole": {
      "hz": 9456.20730695258,
      "r": 0.9621990575588751
     },
     "zero": {
      "hz": 1931.3371655165454,
      "r": 0.9437535570090253
     },
     "scale": 0.5216064453125,
     "provenance": {
      "source": "ref/presets/P2k_013_talking_hedz.bin",
      "architecture": "recipes/architectures/P2k_013_TalkingHedz.json",
      "rate_authority": "evidence/emulatorx_binary_filter_rip_20260729/P2K_RATE_BANK_MANIFEST.json",
      "method": "isolated_p2k_conditioning_biquad",
      "source_datum_rate_hz": 44100.0,
      "authoring_datum_rate_hz": 44100.0,
      "rate_treatment": "exact 44100 bank; no rate or radius conversion"
     }
    },
    "M0_Q100": {
     "state": "active",
     "candidate": {
      "catalog_record": null,
      "selector": {
       "architecture": "P2k_013_TalkingHedz.json",
       "slot": 1,
       "corner": "M0_Q100",
       "words_u16": [
        27644,
        54012,
        61693,
        28668,
        53646
       ]
      }
     },
     "pole": {
      "hz": 11467.8213441742,
      "r": 0.9990233181741742
     },
     "zero": {
      "hz": 216.88353206721547,
      "r": 0.9228510458001199
     },
     "scale": 0.5487060546875,
     "provenance": {
      "source": "ref/presets/P2k_013_talking_hedz.bin",
      "architecture": "recipes/architectures/P2k_013_TalkingHedz.json",
      "rate_authority": "evidence/emulatorx_binary_filter_rip_20260729/P2K_RATE_BANK_MANIFEST.json",
      "method": "isolated_p2k_conditioning_biquad",
      "source_datum_rate_hz": 44100.0,
      "authoring_datum_rate_hz": 44100.0,
      "rate_treatment": "exact 44100 bank; no rate or radius conversion"
     }
    },
    "M100_Q100": {
     "state": "active",
     "candidate": {
      "catalog_record": null,
      "selector": {
       "architecture": "P2k_013_TalkingHedz.json",
       "slot": 1,
       "corner": "M100_Q100",
       "words_u16": [
        41212,
        50940,
        60412,
        27900,
        53341
       ]
      }
     },
     "pole": {
      "hz": 10148.244839532776,
      "r": 0.9991149562109894
     },
     "zero": {
      "hz": 1826.553445413163,
      "r": 0.9540450861291554
     },
     "scale": 0.511474609375,
     "provenance": {
      "source": "ref/presets/P2k_013_talking_hedz.bin",
      "architecture": "recipes/architectures/P2k_013_TalkingHedz.json",
      "rate_authority": "evidence/emulatorx_binary_filter_rip_20260729/P2K_RATE_BANK_MANIFEST.json",
      "method": "isolated_p2k_conditioning_biquad",
      "source_datum_rate_hz": 44100.0,
      "authoring_datum_rate_hz": 44100.0,
      "rate_treatment": "exact 44100 bank; no rate or radius conversion"
     }
    }
   }
  },
  "lane1": {
   "assignments": {
    "M0_Q0": {
     "state": "active",
     "candidate": {
      "catalog_record": "etl_mokhtari_tanaka_2000",
      "selector": {
       "table": "etl_mokhtari_tanaka_2000",
       "object_id": "ETL_S0001_uu_w01_f3",
       "row": 0,
       "evidence": "measured_same_source"
      }
     },
     "pole": {
      "hz": 378.2,
      "r": 0.9932693970221435
     },
     "zero": {
      "hz": 0.0,
      "r": 0.0
     },
     "scale": 0.18249361328038938,
     "provenance": {
      "source": "etl_mokhtari_tanaka_2000:ETL_S0001_uu_w01_f3",
      "method": "measured F/B -> pole only; r=exp(-pi*bw/fs) at 44100 Hz",
      "leveled": "closed whole-cascade unity-DC correction -59.100 dB distributed over 4 measured lanes; conditioner exact"
     }
    },
    "M100_Q0": {
     "state": "active",
     "candidate": {
      "catalog_record": "hanna_epps_wolfe_2015",
      "selector": {
       "table": "hanna_epps_wolfe_2015",
       "object_id": "HEW15_a_sung",
       "row": 0,
       "evidence": "measured_same_source"
      }
     },
     "pole": {
      "hz": 555.0,
      "r": 0.9951675349646978
     },
     "zero": {
      "hz": 0.0,
      "r": 0.0
     },
     "scale": 0.10278310353703081,
     "provenance": {
      "source": "hanna_epps_wolfe_2015:HEW15_a_sung",
      "method": "measured F/B -> pole only; r=exp(-pi*bw/fs) at 44100 Hz",
      "leveled": "closed whole-cascade unity-DC correction -79.046 dB distributed over 4 measured lanes; conditioner exact"
     }
    },
    "M0_Q100": {
     "state": "active",
     "candidate": {
      "catalog_record": "etl_mokhtari_tanaka_2000",
      "selector": {
       "table": "etl_mokhtari_tanaka_2000",
       "object_id": "ETL_S0001_uu_w01_f3",
       "row": 0,
       "evidence": "measured_same_source"
      }
     },
     "pole": {
      "hz": 378.2,
      "r": 0.9932693970221435
     },
     "zero": {
      "hz": 0.0,
      "r": 0.0
     },
     "scale": 0.19270867007422904,
     "provenance": {
      "source": "etl_mokhtari_tanaka_2000:ETL_S0001_uu_w01_f3",
      "method": "operator_q_pose",
      "broken_from": "linked_exact_to_Q0",
      "leveled": "closed whole-cascade unity-DC correction -57.208 dB distributed over 4 measured lanes; conditioner exact"
     }
    },
    "M100_Q100": {
     "state": "active",
     "candidate": {
      "catalog_record": "hanna_epps_wolfe_2015",
      "selector": {
       "table": "hanna_epps_wolfe_2015",
       "object_id": "HEW15_a_sung",
       "row": 0,
       "evidence": "measured_same_source"
      }
     },
     "pole": {
      "hz": 555.0,
      "r": 0.9951675349646978
     },
     "zero": {